<?xml version="1.0" encoding="UTF-8"?>
<!DOCTYPE plugin SYSTEM "PluginConfiguration.dtd">
<plugin>
	<name>UIDFromCookieProcessingPlugin</name>
	<classLocation/>
	<className>sk.fiit.rabbit.adaptiveproxy.plugins.services.user.UIDFromCookieProcessingPlugin</className>
	<types>
		<type>RequestProcessingPlugin</type>
		<type>ResponseProcessingPlugin</type>
	</types>
	<parameters>
		<param name="scriptUrl">${plugins-core:baseurl}/set_cookie/cookie.js</param>
		<param name="bypassPattern">${plugins-core:baseurl}/set_cookie/cookie.js</param>
		<param name="generateResponse">true</param>
		<param name="cookieDomain">${plugins-core:baseurl}</param>
		<param name="loadAsynchronously">false</param>
	</parameters>
</plugin>