<?xml version="1.0" encoding="UTF-8"?>
<!DOCTYPE plugin SYSTEM "PluginConfiguration.dtd">
<plugin>
	<name>CouchDBLoggingBackendServiceModule</name>
	<classLocation/>
	<className>sk.fiit.rabbit.adaptiveproxy.plugins.services.logging.backends.CouchDBLoggingBackend</className>
	<types>
		<type>RequestServiceModule</type>
		<type>ResponseServiceModule</type>
	</types>
	<parameters>
	</parameters>
</plugin>