<?xml version="1.0" encoding="UTF-8"?>
<!DOCTYPE plugin SYSTEM "PluginConfiguration.dtd">
<plugin>
	<name>BifrostSearchPlugin</name>
	<className>sk.fiit.rabbit.adaptiveproxy.plugins.services.bifrost.BifrostProcessingPlugin</className>
	<types>
		<type>RequestProcessingPlugin</type>
		<type>ResponseProcessingPlugin</type>
	</types>
	<classLocation/>
	<libraries>
		<lib>bifrost/bifrost.jar</lib>
		<lib>bifrost/google-collect-1.0-rc4.jar</lib>
		<lib>bifrost/googler.jar</lib>
		<lib>bifrost/gson-1.4.jar</lib>
		<lib>bifrost/lombok.jar</lib>
		<lib>bifrost/lucene-indexes.jar</lib>
	</libraries>
	<parameters>
		<param name="scriptUrl">http://127.0.0.1:3000/javascripts/bifrost.js</param>
		<param name="bypassPattern">/bifrost/search</param>
		<param name="generateResponse">true</param>
		<param name="allowedDomain">google.</param>
		<param name="recommendationUrlBase">http://127.0.0.1:3000/recommendations/show/</param>
		<param name="recommender">cokeywords</param>
		<param name="maxRecommendedDocuments">4</param>
		<param name="maxDocumentsFromQuery">2</param>
	</parameters>
</plugin>