<?xml version="1.0" encoding="UTF-8"?>
<!DOCTYPE plugin SYSTEM "PluginConfiguration.dtd">
<plugin>
  <name>MySQLDatabaseConnectionProviderService</name>
  <classLocation/>
  <className>sk.fiit.rabbit.adaptiveproxy.plugins.services.database.MySQLDatabaseConnectionProviderServiceModule</className>
  <types>
    <type>RequestServiceModule</type>
    <type>ResponseServiceModule</type>
  </types>
  <parameters>
    <param name="jdbcURL">jdbc:mysql://localhost:3306/proxy?characterEncoding=UTF-8</param>
    <param name="driver">com.mysql.jdbc.Driver</param>
    <param name="userName">proxy</param>
    <param name="password">rabbit</param>
    <param name="validationQuery">SELECT 1</param>
    <param name="idleTestPeriod">1</param>
    <param name="partitionCount">1</param>
    <param name="maxConnectionsPerPartition">5</param>
    <param name="minConnectionsPerPartition">2</param>
  </parameters>
</plugin>
