<?xml version="1.0" encoding="UTF-8"?>
<!DOCTYPE plugin SYSTEM "PluginConfiguration.dtd">
<plugin>
	<name>HtmlInjectorService</name>
	<classLocation/>
	<className>sk.fiit.rabbit.adaptiveproxy.plugins.services.injector.HtmlInjectorServiceModule</className>
	<types>
		<type>ResponseServiceModule</type>
	</types>
	<parameters>
		<param name="endOfBodyExceptions">http://(?:www\.)?google\..*</param>
	</parameters>
</plugin>