<?xml version="1.0" encoding="UTF-8"?>
<!DOCTYPE plugin SYSTEM "PluginConfiguration.dtd">
<plugin>
	<name>UIDRemoverProcessingPlugin</name>
	<classLocation/>
	<className>sk.fiit.rabbit.adaptiveproxy.plugins.services.user.UIDRemoverProcessingPlugin</className>
	<types>
		<type>RequestProcessingPlugin</type>
	</types>
	<parameters>
		<param name="exception">${baseurl}</param>
		<param name="pattern">__peweproxy_uid=</param>
		<param name="header">Cookie</param>
	</parameters>
</plugin>