<?xml version="1.0" encoding="UTF-8"?>
<!DOCTYPE plugin SYSTEM "PluginConfiguration.dtd">
<plugin>
	<name>SetupJavaScriptEnvironmentProcessingPlugin</name>
	<classLocation/>
	<className>sk.fiit.rabbit.adaptiveproxy.plugins.services.injector.SetupJavaScriptEnvironmentProcessingPlugin</className>
	<types>
		<type>ResponseProcessingPlugin</type>
	</types>
	<parameters>
		<param name="jQueryPath">${plugins-core:assets-path}/jquery-1.5.2.js</param>
		<param name="peweproxyPath">${plugins-core:assets-path}/peweproxy.js</param>
	</parameters>
</plugin>