<?xml version="1.0" encoding="UTF-8"?>
<!DOCTYPE plugin SYSTEM "PluginConfiguration.dtd">
<plugin>
	<name>UserPreferencesProcessingPlugin</name>
	<classLocation/>
	<className>sk.fiit.rabbit.adaptiveproxy.plugins.services.bubble.UserPreferencesProcessingPlugin</className>
	<libraries>
	</libraries>
	<types>
		<type>RequestProcessingPlugin</type>
		<type>ResponseProcessingPlugin</type>
	</types>
	<parameters>
		<param name="bypassPattern">adaptive-proxy/user_preferences_call</param>
		<param name="generateResponse">true</param>
		
		
		<param name="defaultVisibility">0</param>
		<param name="pacGeneratorUrl">${plugins-core:baseurl}/sk/broken_page/generate_pac</param>
		<param name="scriptUrl">${plugins-core:assets-path}/peweproxy_reporter.js</param>
		<param name="buttonHTML"><![CDATA[<a href="#" class="__peweproxy_reporter_button"></a>]]></param>
		<param name="windowHTML"></param>
		
	</parameters>
</plugin>


