<?xml version="1.0" encoding="UTF-8"?>
<!DOCTYPE plugin SYSTEM "PluginConfiguration.dtd">
<plugin>
	<name>UserAgentUserIdentificationServiceModule</name>
	<classLocation/>
	<className>sk.fiit.rabbit.adaptiveproxy.plugins.services.user.UserAgentUserIdentificationServiceModule</className>
	<types>
		<type>RequestServiceModule</type>
		<type>ResponseServiceModule</type>
	</types>
	<parameters>
		<param name="idPart">__peweproxy_uid=</param>
	</parameters>
</plugin>