<?xml version="1.0" encoding="UTF-8"?>
<!DOCTYPE plugin SYSTEM "PluginConfiguration.dtd">
<plugin>
	<name>CachingPageInformationProviderService</name>
	<classLocation/>
	<libraries>
		<lib>jkeyextractor.jar</lib>
	</libraries>
	<className>sk.fiit.rabbit.adaptiveproxy.plugins.services.page.CachingPageInformationProviderService</className>
	<types>
		<type>ResponseServicePlugin</type>
	</types>
	<parameters>
	</parameters>
</plugin>