<?xml version="1.0" encoding="UTF-8"?>
<!DOCTYPE plugin SYSTEM "PluginConfiguration.dtd">
<plugin>
	<name>PageAccessLoggingProcessingPlugin</name>
	<classLocation/>
	<className>sk.fiit.rabbit.adaptiveproxy.plugins.services.logging.PageAccessLoggingProcessingPlugin</className>
	<libraries>
	  	<lib>commons-lang-2.5.jar</lib>
	</libraries>
	<types>
		<type>RequestProcessingPlugin</type>
		<type>ResponseProcessingPlugin</type>
	</types>
	<parameters>
	</parameters>
</plugin>