<?xml version="1.0" encoding="UTF-8"?>
<!DOCTYPE plugin SYSTEM "PluginConfiguration.dtd">
<plugin>
	<name>KeywordsDisplayProcessingPlugin</name>
	<classLocation/>
	<className>sk.fiit.rabbit.adaptiveproxy.plugins.services.injector.JavaScriptInjectingProcessingPlugin</className>
	<types>
		<type>RequestProcessingPlugin</type>
		<type>ResponseProcessingPlugin</type>
	</types>
	<parameters>
		<param name="scriptUrl">${proxyurl}/FileSender/keywords.js</param>
		<param name="bypassPattern">keywords/load</param>
		<param name="bypassTo">${baseurl}/keywords/load</param>
		<param name="allowOnlyFor">31a3a516283911df85d8c53077dcaf47,dec1857027cf11df85d7c53077dcaf47,9d0dfaec354311df91a6d97c090686ca</param>
	</parameters>
</plugin>